"start","content"
"0.0"," Hello everyone, welcome to this course of Inteliball."
"3.2800000000000002"," In the module 6 of this course, we will learn how we can visualize our findings during the"
"7.5600000000000005"," analysis for a better understanding of the data."
"10.64"," The objective is to familiarize you with various plots that are used for different set"
"15.120000000000001"," of data such as bar plot, a scatter plot, a histogram, etc. for data that are of the"
"21.0"," type categorical, ordinal or continuous in nature."
